{
  "documento_id": "DOC-CLIN-2026-5120",
  "tipo_archivo": "TEXTO",
  "documento_texto": "HOSPITAL SANTA LUCIA - RESUMEN DE HISTORIA CLINICA. Paciente: Roberto Sanchez, 58 anos. Medico Solicitante: Dra. Claudia Benitez MP 114902. Estudio: Consulta de Seguimiento y Laboratorio. CONCLUSION: Diabetes Mellitus Tipo 2 compensada con control metabolico trimestral satisfactorio. Hemoglobina glicosilada 6.8%. Se ratifica plan terapeutico.",
  "canal_origen": "Historia_Clinica_Electronica"
}
